{
  "$schema": "./locale-packs.schema.json",
  "id": "qcae-locale-packs",
  "version": "1.0.0",
  "instrumentVersion": "1.2.0",
  "locales": {
    "ru": {
      "variant": {
        "items": [2,3,4,5,6,7,8,9,10,11,12,13,14,15,16,18,19,20,21,22,23,24,25,26,27,28,29,30,31],
        "status": "validated-translation",
        "scoreModel": "russian-29",
        "source": "https://doi.org/10.17323/1813-8918-2021-4-685-699",
        "sources": ["okatova-2021"],
        "note": "The published Russian adaptation contains 29 items and excludes original QCAE items 1 and 17."
      },
      "responseLabels": ["Полностью не согласен","Скорее не согласен","Скорее согласен","Полностью согласен"],
      "itemText": {
        "2": "При просмотре фильма или спектакля мне обычно удается оставаться объективным, я редко полностью погружаюсь в происходящее",
        "3": "Я стараюсь посмотреть на разногласие с точки зрения каждого участника, прежде чем принять решение",
        "4": "Иногда я пытаюсь лучше понять своих друзей, представляя, как все выглядит с их точки зрения",
        "5": "Когда меня кто-то расстраивает, я стараюсь поставить себя на его место",
        "6": "Прежде чем кого-то критиковать, я пытаюсь представить, как бы я себя чувствовал(а) на его месте",
        "7": "Я часто эмоционально втягиваюсь в проблемы моих друзей",
        "8": "Когда люди вокруг нервничают, я тоже начинаю нервничать",
        "9": "Окружающие меня люди сильно влияют на мое настроение",
        "10": "Я не могу остаться равнодушным(ой), если кто-то из моих друзей выглядит расстроенным",
        "11": "Я часто эмоционально втягиваюсь в переживания героя фильма, спектакля или книги",
        "12": "Я очень расстраиваюсь, когда вижу, как кто-то плачет",
        "13": "Мне радостно в веселой компании и грустно, когда все вокруг хмурые",
        "14": "Меня беспокоит, когда другие волнуются и паникуют",
        "15": "Я легко могу сказать, хочет ли кто-то еще присоединиться к беседе",
        "16": "Я быстро понимаю, когда человек говорит одно, но имеет в виду другое",
        "18": "Мне легко поставить себя на место другого человека",
        "19": "Я хорошо предугадываю, что почувствует другой человек",
        "20": "Я быстро замечаю, когда кто-то в группе чувствует себя неловко или некомфортно",
        "21": "По словам других людей, я хорошо определяю, что они чувствуют и о чем думают",
        "22": "Я легко могу сказать, интересно человеку то, что я говорю, или нет",
        "23": "Друзья делятся со мной своими проблемами, так как, по их словам, я очень понимающий(ая)",
        "24": "Я чувствую, если мешаю, даже если другой человек мне об этом не говорит",
        "25": "Я легко могу определить, о чем может захотеть поговорить другой человек",
        "26": "Я вижу, когда кто-то скрывает свои настоящие эмоции",
        "27": "Я хорошо предугадываю, как поступит другой человек",
        "28": "Обычно я могу оценить точку зрения другого, даже если я с ней не согласен(на)",
        "29": "Обычно при просмотре фильма я остаюсь эмоционально отстраненным",
        "30": "Я всегда стараюсь учитывать чувства других, прежде чем что-либо сделать",
        "31": "Прежде чем что-либо сделать, я стараюсь принять во внимание то, как на это отреагируют мои друзья"
      }
    },
    "ko": {
      "variant": {
        "items": [2,3,4,5,6,7,8,9,10,11,12,13,15,16,19,20,21,22,23,24,25,26,27,29,30,31],
        "status": "validated-translation",
        "scoreModel": "korean-26",
        "source": "https://dl.nanet.go.kr/detail/KDMT1201842578",
        "sources": ["kim-2018"],
        "note": "The validated Korean K-QCAE contains 26 items and excludes original QCAE items 1, 14, 17, 18, and 28."
      },
      "responseLabels": ["전혀 그렇지 않다","그렇지 않다","그렇다","매우 그렇다"],
      "itemText": {
        "2": "나는 영화나 연극을 볼 때 대개 객관적이고, 거기에 완전히 사로잡히는 경우는 거의 없다.",
        "3": "나는 어떤 결정을 내리기 전에 다른 사람의 반대 입장도 살펴보려고 노력한다.",
        "4": "나는 때때로 친구들의 입장에서의 상황을 상상해봄으로써 그들을 더 잘 이해하려고 노력한다.",
        "5": "누군가에게 화가 났을 때 나는 대개 잠시 동안 그 사람의 입장이 되어 보려고 노력한다.",
        "6": "나는 누군가를 비난하기 전에 내가 그 사람의 입장이었다면 어떤 느낌일지 상상해 보려고 노력한다.",
        "7": "나는 자주 내 친구들의 문제에 감정적으로 이입하게 된다.",
        "8": "나는 주변에 있는 사람들이 불안해하면 같이 불안해지곤 한다.",
        "9": "나는 같이 있는 사람들의 기분에 강한 영향을 받는다.",
        "10": "나는 친구들 중 한 명이 속상해 보이면 아주 많이 영향을 받는다.",
        "11": "나는 자주 영화나 연극, 소설 속 등장인물의 감정에 깊이 이입하곤 한다.",
        "12": "나는 누군가가 우는 것을 보면 매우 속상하다.",
        "13": "나는 쾌활한 사람들과 함께 있을 때면 행복하고, 침울한 사람들과 함께 있을 때면 슬프다.",
        "15": "나는 다른 사람이 대화에 참여하고 싶어 할 때 그것을 쉽게 알아차릴 수 있다.",
        "16": "나는 상대방이 말하는 것이 실제로 뜻하는 것과 다를 때 재빨리 알아차릴 수 있다.",
        "19": "나는 다른 사람이 어떻게 느낄지 잘 예측한다.",
        "20": "나는 집단의 어떤 사람이 어색해하거나 불편해할 때 금방 알아차릴 수 있다.",
        "21": "사람들은 내가 그들이 어떻게 느끼고 무엇을 생각하는지 잘 이해해준다고 말한다.",
        "22": "나는 다른 사람이 내가 말하고 있는 것을 재미있어하는지 지루해하는지 쉽게 알아차릴 수 있다.",
        "23": "친구들은 내가 이해심이 많다고 여겨 자신들의 문제를 이야기한다.",
        "24": "나는 누군가에게 방해가 될 때, 상대가 나에게 굳이 말해 주지 않아도 그것을 느낄 수 있다.",
        "25": "나는 다른 사람이 무엇에 대해 이야기하고 싶어 하는지 쉽게 파악할 수 있다.",
        "26": "나는 누군가가 자신의 진짜 감정을 숨길 때 그것을 알아차릴 수 있다.",
        "27": "나는 다른 사람이 어떤 행동을 할지 잘 예측한다.",
        "29": "나는 영화를 볼 때 대개 감정을 이입하지 않는다.",
        "30": "나는 항상 무언가를 하기 전에 동료들이 어떻게 느낄지 생각해 보려고 노력한다.",
        "31": "어떤 일을 하기 전에, 나는 내 친구들이 어떤 반응을 보일지 생각해 보려고 노력한다."
      }
    }
  }
}
